{
  "$schema": "http://json-schema.org/draft-07/schema#",
  "title": "KirbyText split/restore conformance case",
  "description": "Consumed by both the Vitest and PHPUnit KirbyText suites – the corpus is the shared interface of the two implementations.",
  "type": "object",
  "required": [
    "input",
    "kirbyTagTypes",
    "kirbyTags",
    "expectedUnitTexts",
    "expectedPlaceholderCount",
    "restoredWith",
    "expectedRestore"
  ],
  "additionalProperties": false,
  "properties": {
    "$schema": {
      "type": "string"
    },
    "description": {
      "type": "string"
    },
    "input": {
      "type": "string"
    },
    "kirbyTagTypes": {
      "description": "The registered KirbyTag types, lowercased – a parenthetical of any other type is prose.",
      "type": "array",
      "items": {
        "type": "string"
      }
    },
    "kirbyTags": {
      "type": "object",
      "additionalProperties": {
        "type": "array",
        "items": {
          "type": "string"
        }
      }
    },
    "expectedUnitTexts": {
      "type": "array",
      "items": {
        "type": "string"
      },
      "minItems": 1
    },
    "expectedPlaceholderCount": {
      "type": "integer",
      "minimum": 0
    },
    "restoredWith": {
      "type": "array",
      "items": {
        "type": "string"
      },
      "minItems": 1
    },
    "expectedRestore": {
      "type": "string"
    }
  }
}
