{
  "$schema": "./schema.json",
  "description": "A parenthetical that only looks like a tag opener – no KirbyTag has the type `10` – is prose.",
  "input": "Open daily (10:00 - 18:00)",
  "kirbyTagTypes": ["link"],
  "kirbyTags": {},
  "expectedUnitTexts": ["Open daily (10:00 - 18:00)"],
  "expectedPlaceholderCount": 0,
  "restoredWith": ["Täglich geöffnet (10:00 - 18:00)"],
  "expectedRestore": "Täglich geöffnet (10:00 - 18:00)"
}
