{
  "$schema": "./schema.json",
  "description": "The `value` entry in the kirbyTags config exposes the tag's main value for translation.",
  "input": "(callout: Important announcement)",
  "kirbyTagTypes": ["callout"],
  "kirbyTags": {
    "callout": ["value"]
  },
  "expectedUnitTexts": ["<c0/>", "Important announcement"],
  "expectedPlaceholderCount": 1,
  "restoredWith": ["<c0/>", "Wichtige Mitteilung"],
  "expectedRestore": "(callout: Wichtige Mitteilung)"
}
