{
  "$schema": "./schema.json",
  "input": "Visit (link: /a text: our site)!",
  "kirbyTagTypes": ["link"],
  "kirbyTags": {
    "link": ["text"]
  },
  "expectedUnitTexts": ["Visit <c0/>!", "our site"],
  "expectedPlaceholderCount": 1,
  "restoredWith": ["Besuche <c0/>!", "unsere Seite"],
  "expectedRestore": "Besuche (link: /a text: unsere Seite)!"
}
